<?xml version="1.0" encoding="UTF-8"?>
<Product ProductID="123" Category="bicycle"
 xmlns:xsi="http://www.w3.org/2001/XMLSchema-instance"
 xsi:noNamespaceSchemaLocation="produto.xsd">
<ProductName>Bicicleta de 3 Rodas</ProductName>
 <ProductType>Utilitário</ProductType>
 <Price>120</Price>
 <Class>Sport</Class>
 <Company>ABC Int.</Company>
 <Provider>
 <Name>João</Name>
 <City>Viseu</City>
 </Provider>
</Product>
